Recommandabilité,Recommandation,Précisions,QA mauvaise,Axe routier,Jardin,Balcon/Terrasse,Vélo/trottinette/skateboard,Transports en commun,Voiture,Deux roues motorisé,Activité physique,Allergies,Enfants,Niveau de difficulté,Autres conditions,Sources,Catégorie,Objectif
Utilisable,Il est conseiller de décorer son logement avec des produits dont l’étiquette “Emissions dans l’air intérieur”est au niveau A+.,"💡 Depuis 2013, tous les produits de construction et décoration (cloisons, revêtements de sols, isolants, peintures, vernis, colles, adhésifs) sont munis d'une étiquette qui indique leur niveau d’émission en polluants volatils, du moins polluant A+ au plus polluant C.",,,,,,,,,,,,Intermédiaire,Population générale,"ADEME / https://particuliers.ademe.fr/maison/menage/comment-assainir-lair-partout-dans-la-maison
 https://www.cohesion-territoires.gouv.fr/etiquetage-des-produits-de-construction",Air intérieur,Agir pour sa santé
Utilisable,"N'abusez pas des bougies, de l'encens et des parfums d'intérieur, ou aérez dans le cas contraire en cas d'utilisation.","💡Les sprays et diffuseurs à base d'huiles essentielles émettent des polluants dans l'air intérieur dont certains peuvent être irritants en particulier pour les personnes atteintes de maladies respiratoires chroniques telles que l’asthme, et d'autres personnes fragiles (nourrissons, femmes enceintes...)",,,,,,,,,,,,Facile,Population générale,ADEME / https://particuliers.ademe.fr/maison/menage/comment-assainir-lair-partout-dans-la-maison,Air intérieur,Agir pour sa santé
Utilisable,"Les plantes n'ont pas d'effet ""dépolluant"" sur votre air intérieur.","ℹ️ Les tests réalisés démontrent que dans les bâtiments, l’efficacité d’épuration de l’air par les plantes seules est inférieure à l’effet du taux de renouvellement de l’air sur les concentrations de polluants. 
💡L’aération et la ventilation restent bien plus efficaces que l’épuration par les plantes. 
Source : ADEME",,,,,,,,,,,,,,,,
Utilisable,Utiliser un purificateur d'air chez soi ne garantit pas un air sain.,"ℹ️ Les épurateurs d’air (appareils, sprays assainissant…) n’ont pas d’efficacité prouvée en conditions réelles d’utilisation.

💡L’aération et la ventilation restent les moyens les plus efficaces d'améliorer votre air intérieur.",,,,,,,,,,,,Facile,Population générale,"ADEME / https://particuliers.ademe.fr/maison/menage/comment-assainir-lair-partout-dans-la-maison
 Expertise Anses sur les épurateurs d'air : https://www.anses.fr/fr/content/%C3%A9purateurs-d%E2%80%99air-int%C3%A9rieur-une-efficacit%C3%A9-encore-%C3%A0-d%C3%A9montrer",Air intérieur,Agir pour sa santé
Utilisable,"A pieds, préférez les voies piétonnes ou les rues moins encombrées par le trafic.","ℹ️ Le transport routier (voitures, deux roues, poids lourds...) émet du monoxyde de carbone, de l'oxyde d'azote et des particules fines. Ces polluants ont des effets négatifs sur la santé. 
💡 Les niveaux de pollution varient tout au long de la journée. Les niveaux les plus importants pour le dioxyde d’azote sont pendant les heures de pointes du matin et du soir.",,,,,,,,,,,,Intermédiaire,Population générale,https://www.airparif.asso.fr/_pdf/les-petits-gestes-au-quotidien.pdf,Déplacements,Agir pour sa santé
Utilisable,"Durant vos travaux, avant tout achat de matériaux, il faut prendre le temps de consulter l’étiquette “Emissions dans l’air intérieur” qui signale de façon simple et lisible le niveau d’émission en polluants COV. Le niveau d’émission y est décrit sur une échelle allant de A+ (faible) à C (forte).","ℹ️Les Composés Organiques Volatils (COV) sont des substances chimiques qui s'évaporent plus ou moins rapidement dans l'air à la température ambiante, entraînant ainsi des impacts directs et indirects sur l’homme, les animaux et la nature. 
💡Les COV sont contenus dans de nombreux produits et matériaux tels les désodorisants, les laques, les vernis, les peintures, les colles, les parquets, les solvants, les cires, les produits nettoyants, etc.",,,,,,,,,,,,Intermédiaire,"Population générale, en cas de travaux. ","Air breizh,  https://www.airbreizh.asso.fr/les-bonnes-pratiques/",Air intérieur,Agir pour sa santé
Utilisable,"En voiture, éviter les axes embouteillés et les tunnels.","ℹ️ D'après Airparif les trajets avec tunnel (sur plus de 5% de la durée du trajet) ont des niveaux plus élevés, à cause de l’accumulation de la pollution liée au confinement.",,,,,,,x,x,,,,Intermédiaire,Automobilistes,,Déplacements,Agir pour sa santé
Utilisable,"Il est conseillé de laver les textiles (linge de maison, vêtements, etc.) avant utilisation.",ℹ️ Les textiles neufs contiennent des produits chimiques présents dans les teintures. ,,,,,,,,,,,,Facile,Population générale,https://www.airparif.asso.fr/pollution/air-interieur-generalites,Risque par contact cutané,Agir pour sa santé
Utilisable,Il est conseillé d'interdire certaines pièces aux animaux domestiques (notamment la chambre). ,"ℹ️ La salive, la peau, les glandes anales des animaux domestiques (chat, chien, etc.) sont des réservoirs d'allergènes.

💡 N'oubliez pas d'aérer votre logement !",,,,,,,,,,x,,Facile,"Population générale, ayant des animaux domestiques","https://www.airparif.asso.fr/pollution/air-interieur-generalites 
 Guide Inpes sur la QAI",Air intérieur,Agir pour sa santé
Utilisable,"Aspirer régulièrement la literie, les tissus d'ameublements et de décoration (canapé, tapis, moquette, rideaux, etc.) et changer les sacs d’aspirateur afin d'éliminer les acariens, poils et autres allergènes. 
",💡 Les aspirateurs équipés de filtres HEPA (Haute Efficacité pour les Particules Aériennes) sont les plus efficaces pour retenir les poussières.,,,,,,,,,,x,,Facile,Population générale,"https://www.airparif.asso.fr/pollution/air-interieur-generalites 
 Guide Inpes sur la QAI",Air intérieur,Agir pour sa santé
Utilisable,"Nettoyez fréquemment les draps, couettes, oreillers et aérez régulièrement la literie.","ℹ️ Invisibles à l'œil nu (1/3 de mm), les acariens sont présents dans les lieux où ils trouvent à manger (dans la poussière) et où ils peuvent vivre et se reproduire (humidité).",,,,,,,,,,x,,,,,,
Utilisable,"En saison pollinique, brosser ou laver ou rincer ses cheveux avant de se coucher.","ℹ️ Les cheveux retiennent les pollens et graminés et ce qui peut gêner la respiration pendant le sommeil.
💡Après une douche ou un bain ne pas oublier d'aérer la pièce.",,,,,,,,,,x,,Facile,"Personnes allergiques, en période de pollennisation ",ATMO Grand Est,Pollens,Agir pour sa santé
Utilisable,Eviter les activités physiques à l'extérieur pendant les fortes pollinisations,ℹ️ 25 à 30 % de la population des pays industrialisés sont touchés par des allergies (source : ADEME),,,,,,,,,x,x,,Facile,"Personnes allergiques, en période de pollennisation ",ATMO Grand Est,Pollens,Agir pour sa santé
Doute,Ne pas laisser son linge sécher à l'extérieur.,,,,,,,,,,,x,,Facile,"Personnes allergiques, en période de pollennisation ",ATMO Grand Est,Pollens,Agir pour sa santé
Doute,"Si vous êtes allergique, évitez les promenades dans les champs au printemps ou par temps sec et ensoleillé.",,,,,,,,,,,x,,Facile,"Personnes allergiques, en période de pollennisation ",ATMO Grand Est,Pollens,Agir pour sa santé
Doute,Fermer les fenêtres au moment où les pollens sont très présents dans l'air,,,,,,,,,,,x,,Facile,"Personnes allergiques, en période de pollennisation ",ATMO Grand Est,Pollens,Agir pour sa santé
Doute,"Si vous êtes allergique, jardiner de préférence avec des lunettes et un masque de protection.",,,,x,,,,,,,x,,Facile,"Personnes allergiques, en période de pollennisation ",ATMO Grand Est,Pollens,Agir pour sa santé
Non-utilisable,Eviter de tondre le gazon pendant la saison pollinique.,Contradictoire avec la 73.,,,x,,,,,,,x,,Facile,"Personnes allergiques, graminées",ATMO Grand Est,Activités de jardinage / Pollen,Agir pour sa santé
Doute,"En cas de déplacement en voiture, gardez vos fenêtres fermées",,,,,,,,x,,,x,,Facile,"Personnes allergiques, en période de pollennisation ",ATMO Grand Est,Pollens,Agir pour sa santé
Utilisable,"Eviter les lieux qui ont fait l'objet de travaux récents
","ℹ️ Les matériaux et mobiliers neufs continennent des Composés Organiques Volatils qui s'évaporent dans votre logement et ont des effets négatifs sur la santé (troubles respiratoirs, irritation des yeux, réactions allergiques...). 

💡Les COV sont contenus dans de nombreux produits et matériaux tels les désodorisants, les laques, les vernis, les peintures, les colles, les parquets, les solvants, les cires, les produits nettoyants, etc.",,,,,,,,,,,,Intermédiaire,"Personnes sensibles (nourissons, femmes enceintes, asthmatiques, personnes agées, cardiaques, insuffisants respiratoires)","https://www.airparif.asso.fr/pollution/air-interieur-generalites
Guide INPES sur la QAI",Air intérieur,Agir pour sa santé
Utilisable,"Lors de travaux de bricolage, sortez régulièrement de la pièce pour faire des pauses.",💡Ne pas oublier pendant toute la durée des travaux et plusieurs semaines après.,,,,,,,,,,,,,,,,
Utilisable,"Lors de travaux de bricolage, refermer les récipients pour éviter qu’ils ne s’évaporent et rangez-les toujours hors de portée des enfants, dans un endroit aéré.",💡Ne pas oublier pendant toute la durée des travaux et plusieurs semaines après.,,,,,,,,,,,x,,,,,
Doute,"En période de pollinisation, porter des lunettes",Quel type de lunettes ?,,,,,,,,,,x,,Facile,"Personnes allergiques, en période de pollennisation ",https://www.atmo-bfc.org/tout-sur-l-air/pollens,Pollens,Agir pour sa santé
Utilisable,"En période de pollinisation, il est recommandé de se laver régulièrement le nez avec du sérum physiologique.",,,,,,,,,,,x,,Facile,"Personnes allergiques, en période de pollennisation ",https://www.atmo-bfc.org/tout-sur-l-air/pollens,Pollens,Agir pour sa santé
Non-utilisable,Tondre régulièrement sa pelouse,Contradictoire avec la 68.,,,x,,,,,,,x,,Facile,"Personnes allergiques, en période de pollennisation ",https://www.atmo-bfc.org/tout-sur-l-air/pollens,Activités de jardinage / Pollen,Agir pour sa santé
Utilisable,"Choisir une literie anti-acarienne (rembourrage en latex, coton, laine) plutôt que du polyuréthane.",💡Le polyuréthane (mousse inflammable qui contient des retardateurs de feu dont les substances peuvent être inhalées).,,,,,,,,,,x,,Intermédiaire,,ATMO Nouvelle Aquitaine,Equipements domestiques,Agir pour sa santé
Utilisable,Fermez les portes et fenêtres pendant les tontes.,,,,x,,,,,,,x,,Facile,"Personnes allergiques, en période de pollennisation ",https://www.atmo-bfc.org/tout-sur-l-air/pollens,Graminées,Agir pour sa santé
Doute,Éviter de sortir immédiatement après l'orage,Préciser pourquoi.,,,,,,,,,,x,,Facile,"Personnes allergiques, en période de pollennisation ",https://www.atmo-bfc.org/tout-sur-l-air/pollens,Graminées,Agir pour sa santé
Doute,Préférer les zones côtières pour vos vacances en juillet,Préciser pourquoi.,,,,,,,,,,x,,Intermédiaire,"Personnes allergiques, en période de pollennisation ",https://www.atmo-bfc.org/tout-sur-l-air/pollens,Graminées,Agir pour sa santé
Utilisable,"Changer le filtre à air de votre véhicule une fois par an pour éviter la surconsommation, la pollution, et même la panne moteur.","💡Une voiture mal entretenue pollue plus. Réviser son véhicule régulièrement permet de faire des économies et de limiter ses émissions de polluants.
",,,,,,,x,,,,,Facile,Automobilistes,https://www.atmo-bfc.org/tout-sur-l-air/agir-pour-l-air,Déplacements,Agir pour la qualité de l'air
Utilisable,Il est préférable d'acheter un véhicule bien classé sur l’étiquette énergie : il consommera moins de carburant et rejettera moins de polluants.,"ℹ️ L’étiquette environnementale est affichée sur tous les véhicules. L’échelle de A à G, indique les émissions de CO2 du véhicule. 

💡Les émissions de CO2 produites par un véhicule sont liées à l’efficacité énergétique d’un véhicule, car moins on consomme de carburant, moins on émet de CO2, et moins on contribue au changement climatique.",,,,,,,x,x,,,,Intermédiaire,Automobilistes,https://www.atmo-bfc.org/tout-sur-l-air/agir-pour-l-air,Déplacements,Agir pour la qualité de l'air
Utilisable,"J’effectue mes travaux de bricolage quand le temps permet, de manière à pouvoir bien aérer mon logement.","💡 Depuis 2013, tous les produits de construction et décoration (cloisons, revêtements de sols, isolants, peintures, vernis, colles, adhésifs) sont munis d'une étiquette qui indique leur niveau d’émission en polluants volatils, du moins polluant A+ au plus polluant C.",,,x,x,,,,,,,,Intermédiaire,Population générale,https://www.atmo-bfc.org/tout-sur-l-air/agir-pour-l-air,Air intérieur,Agir pour sa santé
Utilisable,"Bricoler à l'extérieur lorsque c'est possible, de préférence le matin ou le soir pour éviter les heures de fort ensoleillement.","💡 Depuis 2013, tous les produits de construction et décoration (cloisons, revêtements de sols, isolants, peintures, vernis, colles, adhésifs) sont munis d'une étiquette qui indique leur niveau d’émission en polluants volatils, du moins polluant A+ au plus polluant C.",,,x,x,,,,,,,,Facile,Population générale,https://www.atmo-bfc.org/tout-sur-l-air/agir-pour-l-air,Air intérieur,Agir pour sa santé
Utilisable,"Lors de travaux de bricolage, porter des protections adaptées (masque, lunettes, gants) lors de la manipulation de produits chimiques ou lors du ponçage.",ℹ️ Les produits d'entretien et de bricolage courants contiennent des substances issues de la pétrochimie nocives pour la santé. Pour en savoir plus.,,,,,,,,,,,,Intermédiaire,"Population générale, en cas de travaux. ",https://www.madininair.fr/A-la-maison,Air intérieur,Agir pour sa santé
Utilisable,"Stocker ses produits de bricolage dans un lieu adéquat, loin des espaces de vie (éviter le stockage dans la cuisine ou la salle de bain).",ℹ️ Les produits d'entretien et de bricolage courants contiennent des substances issues de la pétrochimie nocives pour la santé. Pour en savoir plus.,,,,,,,,,,,x,Intermédiaire,"Population générale, en cas de travaux",https://www.madininair.fr/A-la-maison,Air intérieur,Agir pour sa santé
Utilisable,"Nettoyer régulièrement les brûleurs de votre cuisinière à gaz.
","ℹ️ Les cuisinières à gaz produisent du dioxyde d'azote, un gaz irritant pouvant causer des problèmes respiratoires chez les personnes sensibles comme les asthmatiques. Il est préférable d'utiliser du vinaigre blanc mélangé à de l'eau chaude. Les grilles peuvent être placées au lave vaisselle.
💡Les brûleurs de la cuisinière à gaz sont propres lorsque l'on obtient un flamme bleue et courte dans chaque orifice. Une flamme bien réglée ne doit pas noircir le fond des casseroles",,,,,,,,,,,,Facile,"Population générale, qui possède une gazinière",https://www.madininair.fr/A-la-maison,Air intérieur,Agir pour sa santé
Utilisable,"Réparer les fuites, les infiltrations d’eau (toitures, tuyauterie, plomberie, joints) le plus rapidement possible pour éviter les moisissures.",ℹ️ La présence de moisissures dans les pièces humides peut-être également le signe d’une mauvaise ventilation !,,,,,,,,,,,,Facile,Population générale,https://www.madininair.fr/A-la-maison,Air intérieur,Agir pour sa santé
Utilisable,"En voiture, il est conseillé de ne pas transporter de charges inutiles. Toute charge superflue entraîne une surconsommation de carburant.",💡 Une galerie de toit consomme en moyenne 10 à 20 % en plus de carburant.,,,,,,,x,x,,,,Facile,Automobilistes,https://www.madininair.fr/Pratiquer-l-eco-conduite,,Agir pour la qualité de l'air
Utilisable,"Ne pas aggraver les effets de cette pollution en ajoutant des facteurs irritants : fumée de tabac, utilisation de solvants en espace intérieur, chauffage au bois, exposition aux pollens en saison, etc.",,x,,,,,,,,,,,Intermédiaire,,Avis de l'HCSP (15/11/2013),Air intérieur,Agir pour sa santé
Non-utilisable,"Si l'habitation est à proximité d'un champ agricole, éviter d'aérer durant les périodes d'épandage.",Donner une information préalablement des périodes d'épandage,,,,,,,,,,,,Facile,"Population générale et particulièrement parents + personnes vulnérables et sensibles
Les périodes de développement sont particulièrement sensibles, comme un bébé en devenir pendant la grossesse, la petite enfance ou la puberté.",,Air extérieur,Agir pour sa santé
Utilisable,"Tous les ans, avant l’hiver, faire vérifier sa chaudière par un professionel qualifié. ","ℹ️ Une chaudière entretenue régulièrement a une durée de vie plus longue, consomme moins de combustible, produit moins de gaz à effet de serre et de polluants.

💡 https://www.faire.gouv.fr/ est le service public qui vous guide dans vos travaux de rénovation énergétique. ",,,,,,,,,,,,Intermédiaire,"Population générale, qui possède une chaudière",Sources MSS/EA,Equipements domestiques,Agir pour sa santé
Utilisable,Ne pas utiliser plus de deux heures un chauffage mobile d’appoint à combustion (type de chauffage poêle à pétrole ou à gaz) et bien aérer en cas d'utilisation.,"ℹ️ Ils augmentent en général beaucoup les consommations.
Certains ne sont pas forcément sûrs : ils peuvent émettre
du monoxyde de carbone, un gaz mortel s’il est inhalé en
grande quantité, et favoriser l’apparition de moisissures
du fait du dégagement d’humidité. Pour en savoir plus sur le chauffage de votre logement.",,,,,,,,,,,,Facile,Population générale utilisant un chauffage d'appoint,"Sources MSS/EA
Ademe pour la précision : https://www.ademe.fr/sites/default/files/assets/documents/guide-pratique-chauffer-mieux-moins-cher.pdf",Air intérieur,Agir pour sa santé
Utilisable,Laver les sols de son logement une fois par semaine afin de se débarrasser des poussières contenant notamment des polluants.,,,,,,,,,,,,,Facile,Population générale,Sources MSS/EA,Air intérieur,Agir pour sa santé
Utilisable,"En hiver, tester avec un détecteur s’il y a du radon dans mon habitation pour protéger mes poumons.","💡 Pour savoir si mon logement se trouve sur un sol qui émet des quantités significatives de radon, je consulte la carte du potentiel radon de ma commune : https://www.irsn.fr/FR/connaissances/Environnement/expertises-radioactivite-naturelle/radon/Pages/5-cartographie-potentiel-radon-commune.aspx#.XxFc7qJTJ5Y 
",,,,,,,,,,,,Intermédiaire,Population générale,Sources MSS/EA,Air intérieur,Agir pour sa santé
Utilisable,"⚠️Lors de pics de pollution, reporter l'utilisation d'un barbecue à combustible solide (bois, charbon, etc.).","ℹ️Les barbecues au charbon de bois émettent un mélange de substances polluantes pour l’air et pouvant occasionner des effets sur notre santé (particules fines, dioxyde de carbone, monoxyde de carbone, oxydes d’azote, composés organiques volatils...).",x,,x,,,,,,,,,Facile,En cas de pic de pollution,https://www.atmo-auvergnerhonealpes.fr/sites/ra/files/atoms/files/campagne_air_et_sante_-_messages_2017.pdf,Air extérieur,Agir pour la qualité de l'air
Utilisable,"⚠️Lors de pic de pollution, abaisser sa vitesse de 20km/h sur les voies où la vitesse maximale autorisée est supérieure ou égale à 90km/h.",ℹ️Réduire sa vitesse permet d'économiser du carburant de limiter les émissions de CO2 générées par le véhicule.,x,,,,,,x,x,,,,Facile,"Automobilistes, en cas de pic de pollution",https://www.atmo-auvergnerhonealpes.fr/sites/ra/files/atoms/files/campagne_air_et_sante_-_messages_2017.pdf,Déplacements,Agir pour la qualité de l'air
Utilisable,"Protéger votre bébé des gaz d'échappement en le surélevant par rapport à la route. Par exemple, en utilisant un porte-bébé.",ℹ️ Les niveaux de pollution diminuent à mesure que l’on s’éloigne du trafic routier.,,,,,,,,,,,x,Facile,Parents d'enfants en bas âge,https://www.atmo-auvergnerhonealpes.fr/sites/ra/files/atoms/files/campagne_air_et_sante_-_messages_2017.pdf,Prévention,Agir pour sa santé
Utilisable,"Avec un enfant, éviter les sorties à proximité des grands
axes routiers aux heures de pointe (7h-10h et 17h-20h).",ℹ️ Les niveaux de pollution diminuent à mesure que l’on s’éloigne du trafic routier.,x,?,,,,,,,,,x,Facile,"Parents d'enfants en bas âge, en cas de pic de pollution aux particules",https://www.atmo-auvergnerhonealpes.fr/sites/ra/files/atoms/files/campagne_air_et_sante_-_messages_2017.pdf,Prévention,Agir pour sa santé
Utilisable,Préférer les pistes cyclables séparées de la voie principale de circulation.,💡 Rouler dans les voies de bus et les pistes cyclables éloigne du trafic routier et permet de diminuer son exposition à la pollution de l'air jusqu’à -30% et de se protéger également des accidents de la route.,,,,,x,,,,,,,Intermédiaire,Cyclistes,"https://www.atmo-auvergnerhonealpes.fr/article/activites-physiques-et-qualite-de-lair-bien-respirer-pour-bien-bouger

Précision : Airparif",Déplacements,Agir pour sa santé
Utilisable,"En vélo, éviter les gaz d'échappement : il est conseillé de se placer devant les voitures au feu rouge et de garder ses distances lorsque l'on suit un véhicule motorisé.","💡Dans une étude réalisée en 2015, l’observatoire régional de surveillance de la qualité de l’air en Occitanie (ex Oramip) a démontré que le choix d'emprunter un axe avec peu de trafic routier a permis de réduire l'exposition moyenne du cycliste ou du piéton d’environ 40 % pour le dioxyde d'azote (NO2) et de 50 % pour les particules PM10.",,,,,x,,,,,,,Facile,Cyclistes,https://www.atmo-auvergnerhonealpes.fr/article/activites-physiques-et-qualite-de-lair-bien-respirer-pour-bien-bouger,Déplacements,Agir pour sa santé
Doute,"Eviter de planter des végétaux qui produise des pollens fortement allergisant (graminées).
","Guide du RNSA sur la végétation en ville
",,,x,x,,,,,,x,,Facile,Personnes allergiques,https://www.hawa-mayotte.fr/actualite/les-bonnes-mani-air-a-adopter-dans-son-jardin,Pollens,Agir pour sa santé
Utilisable,"À vélo, choisir dès que possible un itinéraire évitant les grands axes routiers. ","💡Selon l’Observatoire Régional de Santé d’Ile de France, le choix de l’itinéraire lors d’un trajet à vélo permet de jouer sur deux aspects (temps de trajet et densité de trafic de l’axe parcouru) qui influencent fortement l’exposition à la pollution de l’air. Ainsi, des itinéraires fluides pour les cyclistes et à l’écart des grands axes de circulation peuvent diminuer le niveau d’exposition aux polluants.",,,,,,,,,,,,,,,,
Utilisable,"En cas de fortes chaleurs, il est conseillé d'arroser ses plantes le soir pour éviter l'évaporation de l'eau. ","ℹ️ Dans un appartement, il est important de veiller au taux d'humidité dans l'air afin d'éviter le développement de moisissures.

💡Les moisissures ont des effets néfastes sur la santé et peuvent favoriser le déclenchement de l'asthme et des allergies.",,,x,x,,,,,,,,Facile,"Population générale, qui possède un jardin",https://www.hawa-mayotte.fr/actualite/les-bonnes-mani-air-a-adopter-dans-son-jardin,Air extérieur,Agir pour la qualité de l'air
Utilisable,Ne pas modifier les déplacements indispensables mais éviter les promenades et les activités à l’extérieur.,"ℹ️Dans son logement, ne pas aggraver les effets de cette pollution en ajoutant des facteurs irritants : fumée de tabac, utilisation de solvants en espace intérieur, chauffage au bois, exposition aux pollens en saison, etc.",x,,,,,,,,,,x,Facile,"En cas de dépassement du seuil d'alerte Atmo, pour les enfants de moins de 6 ans",https://atmo-reunion.net/Que-faire-ou-ne-pas-faire-en-cas,Déplacements,Agir pour sa santé
Utilisable,Retourner votre matelas 2 fois par an pour limiter la présence d'allergènes.,,,,,,,,,,,x,,Facile,Population générale,https://atmo-reunion.net/Que-faire-ou-ne-pas-faire-en-cas,Air intérieur/allergènes,Agir pour sa santé
Utilisable,"⚠️En tant que personne sensible, il est conseillé d'éviter de pratiquer une activité physique extérieure.","ℹ️ Aujourd'hui, il y a une forte concentration d'ozone dans l'air.

💡L'ozone est un polluant secondaire issu de réactions chimiques entre les polluants primaires (émis par les voitures et l'industrie). Ces réactions sont notamment accélérées par les rayons du soleil et les fortes chaleurs. ",x,,,,,,,,x,,,,population sensible en cas de pic d'ozone,"Précision de la recommandation ""En cas d'épisode de pollution à l'O3 :
-évitez les sorties durant l'après-midi lorsque l'ensoleillement est maximum"" de l'Arrêté du 13 mars 2018",activité physique,Agir pour sa santé
Utilisable,"⚠️En épisode de pollution, il est recommandé à tous de réduire les activités physiques d'intensité élevée.","Une ""activité physique intense"" est par exemples : courir, grimper une côte à vive allure, faire du vélo à vive allure, faire de l'aérobic, nager à vive l'allure, faire des sports et jeux de compétition (par ex. jeux traditionnels, football, volleyball, hockey, basketball). (Source : OMS)",x,,,,,,,,x,,,Intermédiaire,"Population générale
ℹ️ Niveau d'alerte.",https://www.atmo-auvergnerhonealpes.fr/article/activites-physiques-et-qualite-de-lair-bien-respirer-pour-bien-bouger,activité physique,Agir pour sa santé
